Task,TECH-318,459569,Upgrade to .NET 8 for the Rater site.,,Trivial,Done,Sprint 151: 5/29-6/11/25,,,,Upgrade,NET,Rater,,,Annie Wendel,5/28/2025 14:56,v1.0,Jongman Paek,,v1.0,Manual
Story,TECH-434,459567,"As a Client Site user, I want to see a revised description for tests rated UR- Technical Issue so that II tests are handled inclusively. New description in task.",,Trivial,Done,Sprint 151: 5/29-6/11/25,,,,As a Client Site user,,,,,Annie Wendel,5/28/2025 13:56,v1.0,Vijay Damania,,v1.0,Manual
Story,TECH-438,459565,"As a Client Site user, I want to see a revised description for tests rated NR - Poor Recording Quality so that II tests are handled inclusively. Revised description in task.",,Trivial,Done,Sprint 151: 5/29-6/11/25,,,,As a Client Site user,,,,,Annie Wendel,5/28/2025 13:55,v1.0,Vijay Damania,,v1.0,Manual
Story,TECH-436,459563,"As a rater, I want the existing UR/NR code of Technical Issue… to be changed to Technical Issue: A technical issue makes the test unratable due to distorted sound/video or unplayable files. so that the code can be applied to both ILS and II inclusively.",,Trivial,Done,Sprint 151: 5/29-6/11/25,,,,As a rater,I want the existing UR,,,,Annie Wendel,5/28/2025 13:53,v1.0,Yun Ju Lee,Sprint 152: 6/12 - 6/25/2025,v1.0,Manual
Story,TECH-435,459561,"As a rater, I want the existing UR/NR reason code of Poor Audio Quality to be changed to Poor Recording Quality: Low volume, poor video quality, background noise so that the code can be applied to both ILS and II inclusively.",,Trivial,Done,Sprint 151: 5/29-6/11/25,,,,As a rater,I want the existing UR,Low volume,,,Annie Wendel,5/28/2025 13:52,v1.0,Yun Ju Lee,Sprint 152: 6/12 - 6/25/2025,v1.0,Manual
Story,TECH-433,459559,"As LTI, I want the “NE-Whispers/Murmurs” reason code to be hidden for ASL tests on the Rater and Admin sites so that it is not mistakenly applied to an ASL II assessment.",,Trivial,Done,Sprint 151: 5/29-6/11/25,,,,As LTI,I want the “NE,Whispers,,,Annie Wendel,5/28/2025 13:51,v1.0,Yun Ju Lee,Sprint 152: 6/12 - 6/25/2025,v1.0,Manual
Epic,TECH-1379,459554,INTK-683: APM-Re-Enable Accommodations Status for All Accounts,,Trivial,Done,,,,,INTK,683,APM,,,Annie Wendel,5/28/2025 8:58,v1.0,Vijay Damania,,v1.0,Manual
Story,TECH-941,459550,CLONE - First Test Date field in datamart,,Trivial,Done,Sprint 151: 5/29-6/11/25,,,,CLONE,First Test Date field in datamart,,,,Young-A Son,5/28/2025 7:53,v1.0,Yun Ju Lee,,v1.0,Manual
Epic,TECH-1570,459520,INTK-685: Tech: Updates to eliminate PII from the TDMS DB,,Trivial,In Development,,,,,INTK,685,Tech,,,aapplhelp@languagetesting.com,5/27/2025 10:39,v1.0,Jongman Paek,,v1.0,Manual
Task,TECH-202,459453,Upload lip-synced files and wav files to S3 bucket,,Trivial,To Do,,,,,Upload lip,,,,,Jongman Paek,5/23/2025 11:03,v1.0,Jongman Paek,,v1.0,Manual
Task,TECH-201,459451,Convert audio files to wav in mono channel for the telephone OPIc,,Trivial,To Do,Sprint 157: 8/21 - 9/3/25,,,,Convert,OPIc,,,,Jongman Paek,5/23/2025 11:02,v1.0,Jongman Paek,,v1.0,Manual
Epic,TECH-1677,459438,INTK-684: Diagnostic Grid API for Univ of Utah,,Trivial,Done,,,,,INTK,684,,,,aapplhelp@languagetesting.com,5/22/2025 19:50,v1.0,Vijay Damania,,v1.0,Manual
Task,TECH-320,459433,Upgrade to .NET 8 for OPI audio streaming,,Trivial,Done,Sprint 150: 5/15-5/28/25,,,,Upgrade,NET,OPI,,,Annie Wendel,5/22/2025 17:14,v1.0,Jongman Paek,,v1.0,Manual
Task,TECH-319,459431,Upgrade to .NET 8 for MC API,,Trivial,Done,Sprint 150: 5/15-5/28/25,,,,Upgrade,NET,API,,,Annie Wendel,5/22/2025 17:13,v1.0,Jongman Paek,,v1.0,Manual
Story,TECH-954,459426,CLONE - duplicate Credu OPI request scheduled --- access code 1110667 vs. 1110668,,Trivial,Done,Sprint 150: 5/15-5/28/25,,,,CLONE,duplicate Credu OPI request scheduled,access code 1110667 vs. 1110668,,,Diane Archer,5/22/2025 15:14,v1.0,Rohan Gandhi,Sprint 151: 5/29-6/11/25,v1.0,Manual
Story,TECH-953,459424,CLONE - Vulnerability Disclosure (Security) - Salesforce case 00839435,,Trivial,Done,Sprint 150: 5/15-5/28/25,,,,CLONE,Vulnerability Disclosure (Security),Salesforce case 00839435,,,Mark Dulsky,5/22/2025 15:14,v1.0,Rohan Gandhi,Sprint 151: 5/29-6/11/25,v1.0,Manual
Story,TECH-952,459375,"CLONE - AAPPL Rating Admin issue with queues opening up in ""page 2"" view and with no tests",,Trivial,Done,Sprint 150: 5/15-5/28/25,,,,CLONE,,,,,Kim Sallee,5/20/2025 15:02,v1.0,Jongman Paek,,v1.0,Manual
Bug,TECH-895,459373,"CLONE - AAPPL Rating Admin issue with queues opening up in ""page 2"" view and with no tests",,Trivial,To Do,Sprint 150: 5/15-5/28/25,,Functional,,CLONE,,,,,Kim Sallee,5/20/2025 15:02,v1.0,Yun Ju Lee,Sprint 151: 5/29-6/11/25,v1.0,Manual
Sub-task,TECH-579,459371,"On the user search results screen, hide the controls in the Actions column and add an indicator that the account was deactivated through thsi flow",,Trivial,Done,Sprint 147: 4/3-4/16/25,,,,On the user search results screen,,,,,Annie Wendel,5/20/2025 14:45,v1.0,Stephen Benavides,Sprint 148: 4/17-4/30/25,v1.0,Manual
Sub-task,TECH-578,459369,"On the account home screen for deactivated accounts, update the red messaging to match this ticket's contents",,Trivial,Done,Sprint 147: 4/3-4/16/25,,,,,,,,,Annie Wendel,5/20/2025 14:37,v1.0,Stephen Benavides,Sprint 148: 4/17-4/30/25,v1.0,Manual
Sub-task,TECH-577,459367,Add an * in red next to the Reason field to visually indicate that it is a required field,,Trivial,Done,Sprint 147: 4/3-4/16/25,,,,Add,Reason,,,,Annie Wendel,5/20/2025 14:37,v1.0,Stephen Benavides,Sprint 148: 4/17-4/30/25,v1.0,Manual
Sub-task,TECH-576,459364,Add ability to search for accounts by TMS #,,Trivial,Done,Sprint 147: 4/3-4/16/25,,,,Add,TMS,,,,Annie Wendel,5/20/2025 14:36,v1.0,Valentina Lorusso,Sprint 148: 4/17-4/30/25,v1.0,Manual
Bug,TECH-213,459359,[Rating Admin Site] Weird behavior with Finalizing the OPIc test 2793048 / 2E4025411109,,Trivial,In Testing,Sprint 150: 5/15-5/28/25,,Functional,,2E4025411109,,,,,Alexa Altez,5/20/2025 12:45,v1.0,Alexa Altez,Sprint 151: 5/29-6/11/25,v1.0,Manual
Bug,TECH-346,459356,AAPPL ASL - Captions should not appear in the prompts of II component as default,,Trivial,Done,Sprint 150: 5/15-5/28/25,,Functional,,AAPPL ASL,,,,,Valentina Lorusso,5/20/2025 11:57,v1.0,Valentina Lorusso,,v1.0,Manual
Story,TECH-173,459339,"As a Client Site user, I want smaller uploads that processed immediately to also be displayed on the list of requests on the history screen so that I see a comprehensive list that includes all requests from the last 10 days.",,Trivial,Done,Sprint 152: 6/12 - 6/25/2025,,,,As a Client Site user,,,,,Annie Wendel,5/19/2025 16:12,v1.0,Vijay Damania,,v1.0,Manual
Story,TECH-172,459337,"As a Client Site user, I want to see the AAPPL Test Request History screen after submitting any order, even if it was small and processed immediately, so that the workflow is streamlined. The existing Test Request Summary page should be discontinued.",,Trivial,Done,Sprint 152: 6/12 - 6/25/2025,,,,As a Client Site user,,,,,Annie Wendel,5/19/2025 16:01,v0,Vijay Damania,,v0,Manual
Story,TECH-171,459335,"As a Client Site user, I want the AAPPL Test Request History module to display certain details about each request so that I understand the status of my orders and what has and has not been processed. Details within.",,Trivial,Done,Sprint 152: 6/12 - 6/25/2025,,,,As a Client Site user,,,,,Annie Wendel,5/19/2025 15:50,v1.0,Vijay Damania,,v1.0,Manual
Story,TECH-170,459333,"As a Client Site User, I want to view a summary of all Test Request submittals made in this account in the last 10 days, so I can keep track of recent submissions.",,Trivial,Done,Sprint 152: 6/12 - 6/25/2025,,,,As a Client Site User,,,,,Annie Wendel,5/19/2025 15:48,v1.0,Vijay Damania,,v1.0,Manual
Task,TECH-196,459331,"AAPPL Test Request History is added to the navigation modules for all existing accounts where AAPPL is configured, and added to the automated account creation default list",,Trivial,Done,Sprint 152: 6/12 - 6/25/2025,,,,AAPPL Test,Request History,AAPPL,,,Annie Wendel,5/19/2025 15:46,v1.0,Vijay Damania,Sprint 153: 6/26 - 7/9/25,v1.0,Manual
Story,TECH-1476,459329,"As all machine-rated tests, I want to finalize based on the existing finalization logic and have my results flow to Client Site with the reason code wording above so that users understand the reason behind the rating and pay for the test.",,Trivial,To Do,,,,,As all machine,rated tests,,,,Annie Wendel,5/19/2025 15:11,v1.0,Jongman Paek,,v1.0,Manual
Story,TECH-1475,459327,"As the system, I want to pull browser data from the TDS/Google Analytics and attach it to the test record so that tests taken with an unsupported browser can be flagged on the Admin Site.",,Trivial,To Do,,System,,,As the system,,,,,Annie Wendel,5/19/2025 15:10,v1.0,Jongman Paek,,v1.0,Manual
Story,TECH-1474,459325,"As an Admin Site user, I want to see a flag to the right of UR/NR reason code on tests taken with an unsupported browser so that I choose the correct rating/reason code when finalizing the test.",,Trivial,To Do,,,,,As an Admin Site user,reason code when finalizing the test.,,,,Annie Wendel,5/19/2025 14:38,v1.0,Jongman Paek,,v1.0,Manual
Story,TECH-1473,459323,"As LTI, I want OPIc, WPT, ILS, and PW tests taken with an unsupported browser to all still flow to the rating systems for rating as normal so that a rating can be assigned if possible.",,Trivial,To Do,,System,,,As LTI,I want OPIc,WPT,,,Annie Wendel,5/19/2025 14:37,v1.0,Jongman Paek,,v1.0,Manual
Story,TECH-1472,459321,"As LTI, I want tests finalized with NR: Unsupported Browser, to have the Reason Code display on the TMS Follow up Page and in the TMS SSRS Test Detail report under the UR/NR Reason Codes column so that users understand the rating.",,Trivial,To Do,,,,,As LTI,I want tests finalized with NR,Unsupported Browser,,,Annie Wendel,5/19/2025 14:36,v1.0,Rohan Gandhi,,v1.0,Manual
Story,TECH-1471,459319,"As all machine-rated tests, I want to finalize based on the existing finalization logic and have my results flow to Client Site with the reason code wording above so that users understand the reason behind the rating.",,Trivial,To Do,,,,,As all machine,rated tests,,,,Annie Wendel,5/19/2025 14:35,v1.0,Jongman Paek,,v1.0,Manual
Story,TECH-1470,459317,"As an Admin Site user for OPIc, I want to select this reason code from a dropdown when finalizing human-rated tests with NR: Unsupported Browser so that tests are released with the correct reason code.",,Trivial,To Do,,,,,rated tests with NR,,,,,Annie Wendel,5/19/2025 14:35,v1.0,Jongman Paek,,v1.0,Manual
Story,TECH-1469,459315,"As LTI, when an NR is issued for an OPIc taken with an unsupported browser, I want a reason code to flow to the Client Site explaining the rating. Details in ticket.",,Trivial,To Do,,,,,As LTI,,,,,Annie Wendel,5/19/2025 14:33,v1.0,Jongman Paek,,v1.0,Manual
Story,TECH-1468,459313,"As LTI, when an OPIc is finalized at UR for technical reasons and was taken with an unsupported browser, I want the final rating to be changed to NR so that the test is billable.",,Trivial,To Do,,,,,As LTI,,,,,Annie Wendel,5/19/2025 14:32,v1.0,Jongman Paek,,v1.0,Manual
Story,TECH-1467,459311,"As a test-taker accessing the login screen for OPIc on an unsupported browser, I want to see a warning guiding me to the system check so that I don't receive a UR. Wording within.",,Trivial,To Do,,System,,,As a test,,,,,Annie Wendel,5/19/2025 14:30,v1.0,Jongman Paek,,v1.0,Manual
Task,TECH-1439,459307,"As Magento, I want to detect orders from IP addresses in Cuba, Iran, North Korea, or Syria from purchasing tests and show a message that says. ""Due to US government regulations, LTI is not allowed to conduct business with individuals from your country.",,Trivial,Done,Sprint 156: 8/7 - 8/20/25,,,,As Magento,Iran,North Korea,,,Annie Wendel,5/19/2025 12:44,v1.0,Rohan Gandhi,,v1.0,Manual
Story,TECH-1431,459291,"As a TMS user, I want to see an error message if I try to create/edit a TMS account where the country field in the address or the billing country is Cuba, Iran, North Korea, or Syria so that I understand that I can't proceed due to geofencing.",,Trivial,Done,Sprint 157: 8/21 - 9/3/25,,,,As a TMS user,Iran,North Korea,,,Annie Wendel,5/19/2025 12:38,v1.0,Rohan Gandhi,,v1.0,Manual
Story,TECH-1424,459289,"As the multi-test pop up, if the user clicks Go Back, I want to close the pop up and return to the previous screen with the tests still selected and the ratings still entered so that the user can update as needed and then proceed..",,Trivial,To Do,,,,,As the multi,test pop up,if the user clicks Go Back,,,Annie Wendel,5/19/2025 12:11,v1.0,Jongman Paek,,v1.0,Manual
Story,TECH-1423,459287,"As the multi-test pop up, if the user clicks Proceed, I want to finalize all tests with the assigned ratings so that the user confirms this action.",,Trivial,To Do,,,,,As the multi,test pop up,if the user clicks Proceed,,,Annie Wendel,5/19/2025 12:10,v1.0,Jongman Paek,,v1.0,Manual
Story,TECH-1422,459285,"As an Admin Site user finalizing multiple tests at once, I want to see an error pop up that tells me which Test IDs have ratings outside of the rating range so that I can choose how to handle those exceptions.",,Trivial,To Do,,,,,Admin Site,Test IDs,,,,Annie Wendel,5/19/2025 12:08,v1.0,Jongman Paek,,v1.0,Manual
Story,TECH-1421,459283,"As a WPT admin, I want these alerts to be triggered in the WPT TA Review, Rate Pending, and Rating Management → Search queues so that all locations where tests are finalized are covered.",,Trivial,To Do,,,,,As a WPT admin,Rate Pending,,,,Annie Wendel,5/19/2025 12:05,v1.0,Jongman Paek,,v1.0,Manual
Story,TECH-1420,459281,"As an OPIc admin, I want these alerts to be triggered in the Rate Pending, Retest, Rating Management → Search, and TA Review queues so that all locations where tests are finalized are covered.",,Trivial,To Do,,,,,As an OPIc admin,Retest,Rating Management → Search,,,Annie Wendel,5/19/2025 12:04,v1.0,Jongman Paek,,v1.0,Manual
Story,TECH-1419,459279,"As the system, I want to apply logic to each WPT and OPIc form and rating range so that the Admin Site can then alert users when finalizing a test with a rating outside of the range.",,Trivial,To Do,,System,,,As the system,,,,,Annie Wendel,5/19/2025 12:03,v1.0,Jongman Paek,,v1.0,Manual
Story,TECH-1418,459278,"As an Admin Site user, if I select No, I want the pop up to close and to be returned to the previous screen with the test unaffected so that I can revise the rating or assign to additional raters.",,Trivial,To Do,,,,,As an Admin Site user,if I select No,,,,Annie Wendel,5/19/2025 12:00,v1.0,Jongman Paek,,v1.0,Manual
Story,TECH-1417,459276,"As an Admin Site user, if I select Yes, I want the test to proceed to finalize with the rating that I have indicated so that the rating can be released.",,Trivial,To Do,,,,,As an Admin Site user,if I select Yes,,,,Annie Wendel,5/19/2025 11:59,v1.0,Jongman Paek,,v1.0,Manual
Story,TECH-1416,459274,"As APM, when manually finalizing an ACTFL (not ILR) test rating with a rating that falls outside of the rating range for a test, I want to see a pop up alert that allows me to select Yes or No so that the selection is confirmed. Details in task.",,Trivial,To Do,,,,,As APM,,,,,Annie Wendel,5/19/2025 11:57,v1.0,Jongman Paek,,v1.0,Manual
Story,TECH-105,459272,"As a tester/rater, I want to receive my username and password in 2 separate emails rather than in 1 so that those credentials are more secure.",,Trivial,Done,Sprint 152: 6/12 - 6/25/2025,,,,As a tester,rater,,,,Annie Wendel,5/19/2025 11:50,v1.0,Annie Wendel,Sprint 153: 6/26 - 7/9/25,v1.0,Manual
Story,TECH-185,459270,"As ACTFL, I want the Leanosity Heading field to populate the instructions text for all ILS prompts so that learners see the context for each one.",,Trivial,Done,Sprint 153: 6/26 - 7/9/25,,,,As ACTFL,,,,,Annie Wendel,5/19/2025 11:47,v1.0,Jongman Paek,Sprint 154: 7/10 - 7/23/25,v1.0,Manual
Story,TECH-103,459268,"As APM, I want to hide from the Admin Site Rater Utility screen raters that are selected as AAPPL=No in the TMS Tester Utility so that the list is optimized and performance is improved.",,Trivial,Done,Sprint 151: 5/29-6/11/25,Performance,,,As APM,,,,,Annie Wendel,5/19/2025 11:44,v1.0,Yun Ju Lee,,v1.0,Manual
Task,TECH-200,459258,"Correct prompt text for EN (1), QB (1), KP (100), FR (4), and CM (9) prompts",,Trivial,To Do,,,,,Correct prompt text for EN (1),QB (1),KP (100),,,Annie Wendel,5/19/2025 11:37,v1.0,Jongman Paek,,v1.0,Manual
Task,TECH-199,459256,Replace three OPIc prompt files once lip synced by Sequent,,Trivial,To Do,,,,,Replace,OPIc,Sequent,,,Annie Wendel,5/19/2025 11:35,v1.0,Jongman Paek,,v1.0,Manual
Epic,TECH-151,459225,INTK-681: ACTFL: three OPIc prompts need corrections (and to have the new audio files lip synced for Ava) and several Rater Site prompt script text updates required,,Trivial,To Do,,,,,INTK,681,ACTFL,,,Annie Wendel,5/16/2025 14:04,v1.0,Annie Wendel,,v1.0,Manual
Bug,TECH-216,459223,Rater Site - Unable to Assign Rating to WPT Tests,,Trivial,Done,Sprint 150: 5/15-5/28/25,,Functional,,Rater Site,,,,,Valentina Lorusso,5/16/2025 13:14,v1.0,Yun Ju Lee,,v1.0,Manual
Bug,TECH-215,459221,"Rater Site - ""Rating"" and ""Re-enter Final Rating"" fields briefly show a dropdown for seconds before displaying a text box.",,Trivial,Done,Sprint 150: 5/15-5/28/25,,Functional,,Rater Site,"""Rating"" and ""Re",,,,Valentina Lorusso,5/16/2025 12:29,v1.0,Yun Ju Lee,,v1.0,Manual
Bug,TECH-214,459195,Rating Admin - The system does not allow access to the WPT UR/NR Followup queue,,Trivial,Done,Sprint 150: 5/15-5/28/25,System,Functional,,Rating Admin,NR Followup queue,,,,Valentina Lorusso,5/15/2025 14:21,v1.0,Yun Ju Lee,,v1.0,Manual
Epic,TECH-148,459194,INTK-678: Add AAPPL ILS Text Instructions + Volume Bar,,Trivial,Done,,,,,INTK,678,,,,Annie Wendel,5/15/2025 14:01,v1.0,Annie Wendel,,v1.0,Manual
Epic,TECH-97,459193,INTK-679: APM: Update the email that is sent to Raters when their credentials are created or resent to them from TMS to not include both the username and password in the same email,,Trivial,Done,,,,,INTK,679,APM,,,Annie Wendel,5/15/2025 14:01,v1.0,Annie Wendel,,v1.0,Manual
Epic,TECH-96,459192,INTK-658: Remove raters from display on Admin Site if they are set on TMS to AAPPL=No,,Trivial,Done,,,,,INTK,658,,,,Annie Wendel,5/15/2025 14:00,v1.0,Annie Wendel,,v1.0,Manual
Epic,TECH-1415,459183,APM: System should ask for confirmation when finalizing a rating outside the rating range of the test form taken,,Trivial,To Do,,System,,,APM,,,,,Annie Wendel,5/15/2025 13:11,v1.0,Yun Ju Lee,,v1.0,Manual
Epic,TECH-1430,459182,INTK-600: GeoFence Magento Part 2,,Trivial,Done,,,,,INTK,600,GeoFence Magento Part 2,,,Annie Wendel,5/15/2025 13:10,v1.0,Rohan Gandhi,,v1.0,Manual
Epic,TECH-1459,459181,INTK-624: APM: Handling tests when candidate proceeds with unsupported browser,,Trivial,To Do,,,,,INTK,624,APM,,,Annie Wendel,5/15/2025 13:08,version that,Jongman Paek,,version that,Manual
Task,TECH-1566,459178,Configure API connection to return a JSON object for RIDE.,,Trivial,Done,Sprint 157: 8/21 - 9/3/25,,,,Configure API,JSON,RIDE,,,Annie Wendel,5/15/2025 13:04,v1.0,Vijay Damania,,v1.0,Manual
Story,TECH-1297,459177,"As WestJet, I want the candidate type to flow to the Notes field in TMS so that I can receive a separate invoice for ""Current Employee"" vs. ""New.""",,Trivial,Done,Sprint 154: 7/10 - 7/23/25,,,,As WestJet,,,,,Annie Wendel,5/15/2025 13:02,v1.0,Vijay Damania,,v1.0,Manual
Story,TECH-1665,459175,"As a Rating Admin, I want all routing and finalization to follow the new logic for non-Spanish PW tests to ensure consistency.",,Trivial,Ready for Testing,Sprint 165: 12/10 - 12/24/25,,,,As a Rating Admin,Spanish PW tests to ensure consistency.,,,,Annie Wendel,5/15/2025 12:28,v1.0,Yun Ju Lee,Sprint 166: 12/24/25 - 1/7/26,v1.0,Manual
Story,TECH-1664,459174,"As a Rating Admin, I want only tests needing a 4th rating to flow to the “Final Ratings Held” queue for manual handling.",,Trivial,Ready for Testing,Sprint 165: 12/10 - 12/24/25,,,,As a Rating Admin,,,,,Annie Wendel,5/15/2025 12:28,v1.0,Yun Ju Lee,Sprint 166: 12/24/25 - 1/7/26,v1.0,Manual
Story,TECH-1663,459173,"As a Rating Admin, I want Mentor Raters to fetch tests requiring a third rating from the Rate Pending queue automatically to reduce admin manual assignments.",,Trivial,Ready for Testing,Sprint 165: 12/10 - 12/24/25,,,,As a Rating Admin,,,,,Annie Wendel,5/15/2025 12:27,v1.0,Yun Ju Lee,Sprint 166: 12/24/25 - 1/7/26,v1.0,Manual
Story,TECH-1668,459172,"As a Rating Admin, I want all tests needing a 2nd or 3rd rating to flow to the Rate Pending queue to streamline processing.",,Trivial,Ready for Testing,Sprint 165: 12/10 - 12/24/25,,,,As a Rating Admin,,,,,Annie Wendel,5/15/2025 12:27,v1.0,Yun Ju Lee,Sprint 166: 12/24/25 - 1/7/26,v1.0,Manual
Story,TECH-1667,459171,"As a Rating Admin, I want tests with non-adjacent scores to flow to Rate Pending and require a third rating based on the new logic to improve rating accuracy and automate the process.",,Trivial,Ready for Testing,Sprint 165: 12/10 - 12/24/25,,,,As a Rating Admin,I want tests with non,,,,Annie Wendel,5/15/2025 12:27,v1.0,Yun Ju Lee,Sprint 166: 12/24/25 - 1/7/26,v1.0,Manual
Story,TECH-1666,459170,"As a Rating Admin, I want tests with one rating of N4 and another of Below N4 to auto finalize at N4 so that manual work is reduced.",,Trivial,Ready for Testing,Sprint 165: 12/10 - 12/24/25,,,,As a Rating Admin,,,,,Annie Wendel,5/15/2025 12:27,v1.0,Yun Ju Lee,Sprint 166: 12/24/25 - 1/7/26,v1.0,Manual
Story,TECH-1661,459169,"As a Rating Admin, I want tests with one rating of N1 and another of Below N1 to auto finalize at N1 so that manual work is reduced.",,Trivial,Ready for Testing,Sprint 165: 12/10 - 12/24/25,,,,As a Rating Admin,,,,,Annie Wendel,5/15/2025 12:27,v1.0,Yun Ju Lee,Sprint 166: 12/24/25 - 1/7/26,v1.0,Manual
Story,TECH-1660,459168,"As a Rating Admin, I want tests with two Below N1 (Form A) or Below N4 (Form B) ratings to auto-finalize based on new logic so they don’t require manual review.",,Trivial,Ready for Testing,Sprint 165: 12/10 - 12/24/25,,,,As a Rating Admin,,,,,Annie Wendel,5/15/2025 12:27,v1.0,Yun Ju Lee,Sprint 166: 12/24/25 - 1/7/26,v1.0,Manual
Story,TECH-112,459164,"As a BOA Rater, I can can fetch BOA test regardless of my OPIc certification condition.",,Trivial,Done,Sprint 150: 5/15-5/28/25,,,,As a BOA Rater,,,,,Yun Ju Lee,5/15/2025 5:14,v1.0,,Sprint 151: 5/29-6/11/25,v1.0,Manual
Story,TECH-111,459163,"As a MTA Rater, I can can fetch MTA test regardless of my OPIc certification condition.",,Trivial,Done,Sprint 150: 5/15-5/28/25,,,,As a MTA Rater,,,,,Yun Ju Lee,5/15/2025 5:13,v1.0,,Sprint 151: 5/29-6/11/25,v1.0,Manual
Story,TECH-110,459162,As a Rater I need to fetch OPIc test based on my full/limited certification information.,,Trivial,Done,Sprint 150: 5/15-5/28/25,,,,limited certification information.,,,,,Yun Ju Lee,5/15/2025 5:13,v1.0,,Sprint 151: 5/29-6/11/25,v1.0,Manual
Story,TECH-109,459161,"As a Rater Admin, I need to see OPIc full/limited certification information in the rater utility in Rating Admin.",,Trivial,Done,Sprint 150: 5/15-5/28/25,,,,As a Rater Admin,I need to see OPIc full,,,,Yun Ju Lee,5/15/2025 5:13,v1.0,,Sprint 151: 5/29-6/11/25,v1.0,Manual
Task,TECH-139,459160,OPIc full/limited certification information needs to flow into the Rating Admin site.,,Trivial,Done,Sprint 150: 5/15-5/28/25,,,,OPIc full,,,,,Yun Ju Lee,5/15/2025 5:13,v1.0,Yun Ju Lee,Sprint 151: 5/29-6/11/25,v1.0,Manual
Story,TECH-108,459159,"As an LTI Admin, I need the ability to indicate whether an OPIc rater has full or limited certification in the tester utility in TMS and for that to flow to the ratings systems so that the Admin Site can behave according to this data.",,Trivial,Done,Sprint 151: 5/29-6/11/25,System,,,As an LTI Admin,,,,,Yun Ju Lee,5/15/2025 5:12,v1.0,Yun Ju Lee,Sprint 152: 6/12 - 6/25/2025,v1.0,Manual
Story,TECH-107,459153,"As a B2C customer, I want to receive a notification when my transaction has failed and been reprocessed so that I can be informed of next steps required of me such as choosing a new test time with the remote proctor.",,Trivial,Approved for Release,Sprint 150: 5/15-5/28/25,,,,As a B2C customer,,,,,Annie Wendel,5/14/2025 15:47,v1.0,,Sprint 151: 5/29-6/11/25,v1.0,Manual
Story,TECH-106,459151,"As LTI Support, I want an automated daily process to pull failed transaction data from Magento and create the test record in TMS so that I don't have to manually do so.",,Trivial,Approved for Release,Sprint 150: 5/15-5/28/25,,,,As LTI Support,,,,,Annie Wendel,5/14/2025 15:44,v1.0,,Sprint 151: 5/29-6/11/25,v1.0,Manual
Epic,TECH-98,459149,INTK-632: Tech: Develop an automated API call to pull failed transactions from Magento and run a once daily process to create the record in TMS,,Trivial,In Development,,,,,INTK,632,Tech,,,Annie Wendel,5/14/2025 15:42,v1.0,Annie Wendel,,v1.0,Manual
Epic,TECH-146,459143,2025 Bank of America Security Audit,,Trivial,Done,,,,,2025 Bank of America Security Audit,,,,,Annie Wendel,5/14/2025 14:54,v1.0,Annie Wendel,,v1.0,Manual
Story,TECH-184,459141,"As BoA, I want the password history requirements for Client Site and TMS to be a minimum of eight (8) previous passwords so that security standards are met.",,Trivial,Done,Sprint 150: 5/15-5/28/25,,,,As BoA,,,,,Annie Wendel,5/14/2025 14:51,v1.0,Vijay Damania,,v1.0,Manual
Epic,TECH-1676,459139,INTK-638: 2nd Rating Auto-Finalization & 3rd Rate Fetching - CAPEX2025_APM_022_03,,Trivial,In Development,,,,,INTK,638,2nd Rating Auto,,,Annie Wendel,5/14/2025 14:31,v1.0,Jongman Paek,,v1.0,Manual
Test Execution,TECH-310,459136,Rating Admin - Route WPT tests with an NR or UR rating to the UR Followup Queue,,Trivial,Done,Sprint 149: 5/1-5/14/25,,,,Rating Admin,,,,,Valentina Lorusso,5/14/2025 13:38,v1.0,Valentina Lorusso,Sprint 150: 5/15-5/28/25,v1.0,Manual
